Sheet: batch_1
A1: mpi | B1: Vecadd (min) | C1: Vecadd (max) | D1: Variation
A2: 1 | B2: 0.846750974655151 | C2: 0.84876561164856 | D2: of:=[.C2]-[.B2] -> 0.00201463699340887
A3: 2 | B3: 0.424673080444336 | C3: 0.426772117614746 | D3: of:=[.C3]-[.B3] -> 0.00209903717040993
A4: 4 | B4: 0.210283994674683 | C4: 0.214402914047241 | D4: of:=[.C4]-[.B4] -> 0.00411891937255798
A5: 8 | B5: 0.10453200340271 | C5: 0.11067795753479 | D5: of:=[.C5]-[.B5] -> 0.00614595413208001
A7: mpi | B7: Vecadd (min) | C7: Vecadd (max) | D7: Variation | E7: Time difference
A8: 1 | B8: 0.847912549972534 | C8: 0.849803686141968 | D8: of:=[.C8]-[.B8] -> 0.00189113616943415 | E8: of:=[.B8]-[.B2] -> 0.00116157531738281
A9: 2 | B9: 6.68021726608276 | C9: 6.90085577964783 | D9: of:=[.C9]-[.B9] -> 0.22063851356507 | E9: of:=[.B9]-[.B3] -> 6.25554418563842
A10: 4 | B10: 6.96076822280884 | C10: 7.19100642204285 | D10: of:=[.C10]-[.B10] -> 0.230238199234011 | E10: of:=[.B10]-[.B4] -> 6.75048422813416
A11: 8 | B11: 6.69590187072754 | C11: 6.87293338775635 | D11: of:=[.C11]-[.B11] -> 0.17703151702881 | E11: of:=[.B11]-[.B5] -> 6.59136986732483

Sheet: batch_2
A1: mpi | B1: vecadd | C1: vecsum | D1: trimv | E1: total
A2: 1 | B2: 0.850816249847412 | C2: 0.447412729263306 | D2: 1.72529172897339 | E2: 6.68193006515503
A3: 2 | B3: 0.42540431022644 | C3: 0.222224950790405 | D3: 0.863617420196533 | E3: 3.75699591636658
A4: 4